{
  "schema_version": "static_chart.v0.1",
  "meta": {
    "id": "scenario_03",
    "datetime_local": "2012-02-15T12:00:00",
    "datetime_utc": "2012-02-15T11:00:00Z",
    "timezone": "Europe/Stockholm",
    "utc_offset": "+01:00",
    "dst": false,
    "zodiac": "sidereal",
    "ayanamsa_id": "lahiri",
    "ayanamsa_dms": "24°00'38.05\"",
    "house_system_id": "whole_sign"
  },
  "location": {
    "name": "Stockholm, Sweden",
    "lat": 56.1333333333,
    "lon": 13.4166666667,
    "alt_m": 0.0
  },
  "points": {
    "asc": { "dms": "09°Ge08'32.58\"", "rasi": "Gemini" },
    "sun": { "dms": "02°Aq08'57.90\"", "rasi": "Aquarius" },
    "moon": { "dms": "11°Sc49'58.94\"", "rasi": "Scorpio" },
    "mars": { "dms": "25°Le50'06.11\"", "rasi": "Leo", "retrograde": true },
    "mercury": { "dms": "08°Aq32'59.48\"", "rasi": "Aquarius" },
    "jupiter": { "dms": "10°Ar35'20.77\"", "rasi": "Aries" },
    "venus": { "dms": "14°Pi25'51.11\"", "rasi": "Pisces" },
    "saturn": { "dms": "05°Li26'14.32\"", "rasi": "Libra", "retrograde": true },
    "rahu": { "dms": "16°Sc33'24.85\"", "rasi": "Scorpio" },
    "ketu": { "dms": "16°Ta33'24.85\"", "rasi": "Taurus" }
  },
  "houses_whole_sign": {
    "1": { "rasi": "Gemini", "cusp": "09°Ge08'32.58\"" },
    "2": { "rasi": "Cancer", "cusp": "09°Cn08'32.58\"" },
    "3": { "rasi": "Leo", "cusp": "09°Le08'32.58\"" },
    "4": { "rasi": "Virgo", "cusp": "09°Vi08'32.58\"" },
    "5": { "rasi": "Libra", "cusp": "09°Li08'32.58\"" },
    "6": { "rasi": "Scorpio", "cusp": "09°Sc08'32.58\"" },
    "7": { "rasi": "Sagittarius", "cusp": "09°Sg08'32.58\"" },
    "8": { "rasi": "Capricorn", "cusp": "09°Cp08'32.58\"" },
    "9": { "rasi": "Aquarius", "cusp": "09°Aq08'32.58\"" },
    "10": { "rasi": "Pisces", "cusp": "09°Pi08'32.58\"" },
    "11": { "rasi": "Aries", "cusp": "09°Ar08'32.58\"" },
    "12": { "rasi": "Taurus", "cusp": "09°Ta08'32.58\"" }
  }
}
